{
  "skill_id": "filesystem",
  "name": "파일시스템 관리",
  "version": "1.0.0",
  "description": "파일 읽기/쓰기/검색 기능. 레포 내부 경로만 접근 허용하며, 바이너리·비밀키 파일을 자동 차단한다.",
  "category": "filesystem",
  "dependencies": [],
  "cost": "free",
  "inputs": [
    {"name": "action", "type": "string", "description": "수행할 작업: read | write | search | list_dir", "required": true},
    {"name": "path", "type": "string", "description": "대상 파일 또는 디렉토리 경로 (레포 루트 상대경로)", "required": true},
    {"name": "content", "type": "string", "description": "write 시 저장할 내용", "required": false},
    {"name": "pattern", "type": "string", "description": "search 시 검색할 정규식 패턴", "required": false}
  ],
  "outputs": [
    {"name": "result", "type": "string", "description": "작업 결과 (파일 내용, 검색 결과, 디렉토리 목록 등)"},
    {"name": "success", "type": "boolean", "description": "성공 여부"}
  ],
  "safety_rules": [
    "레포 루트(PROJECT_ROOT) 외부 경로 접근 금지",
    ".env, .secret, credentials, *_key, *.pem 파일 읽기/쓰기 차단",
    "바이너리 파일(>1MB) 쓰기 금지",
    "심볼릭 링크가 레포 외부를 가리키면 차단",
    "write 작업 전 기존 파일 백업(*.bak) 생성 권장"
  ],
  "examples": [
    {
      "description": "파일 읽기",
      "input": {"action": "read", "path": "core/agent_creator.py"},
      "expected_output": {"result": "<파일 내용>", "success": true}
    },
    {
      "description": "디렉토리 목록 조회",
      "input": {"action": "list_dir", "path": "agents/"},
      "expected_output": {"result": "['A0001', 'A0007', ...]", "success": true}
    }
  ],
  "prompt": "너는 파일시스템 관리 스킬이다. 파일 읽기/쓰기/검색/목록조회를 수행한다. 반드시 레포 내부 경로만 접근하고, 비밀키나 인증정보 파일은 절대 접근하지 마라."
}
